,年份,报告标题,披露时间,披露机构,攻击方法,组织别名,报告摘要
80,2019 (398),Clop勒索软件针对法国和比利时大学，禁用杀软逃避检测,2019-11-22,BleepingComputer,暂无数据,暂无数据,最近，国外研究人员发现Clop勒索软件正在尝试禁用Windows Defender并删除Microsoft Security Essentials和Malwarebytes的独立反勒索程序。Clop是CryptoMix勒索软件的变体，在加密之前，该程序通过配置各种注册表值，禁用行为监视、实时保护、样本上传、篡改保护、云检测和反间谍软件检测，以尝试禁用Windows Defender。除了Windows Defender，Clop还通过卸载Microsoft Security Essentials和Malwarebytes反勒索软件程序来针对较旧的计算机。该勒索软件最近攻击了法国的鲁昂大学医院中心和比利时的安特卫普大学。
81,2019 (398),BlackTech组织使用IconDown恶意软件对日本的攻击,2019-11-21,jpcert,暂无数据,BlackTech黑凤梨 T-APT-03,BlackTech使用各种类型的恶意软件对日本进行攻击，近期发现该组织利用IconDown恶意软件，该恶意软件通过ASUS WebStorage的更新功能进行传播。
82,2019 (398),黄金雕（APT-C-34）组织攻击活动揭露,2019-11-21,360,暂无数据,APT-C-34黄金雕,"360 高级威胁应对团队通过关联 Hacking Team 武器，发现了一支活跃在中亚地区，从未被外界知晓的APT组织黄金雕（APT-C-34）。该组织制作了大量的伪装的文档和图片文件作为鱼叉攻击的诱饵，这些文件通过伪装图标诱导用户点击，实际上是 EXE 和 SRC 后缀的可执行文件，同时会释放弹出真正的文档和图片欺骗受害者。其中部分诱饵程序安装包脚本会自动将程序添加到注册表项中，实现自启动驻留。除此之外，该组织还使用物理接触手段进行攻击，部分受害者曾经接入过包含恶意程序和安装脚本的 U 盘。同时该组织也使用了 HackingTeam 的物理攻击套件，该套件需要通过恶意硬件物理接触目标机器，在系统引导启动前根据系统类型植入恶意程序，支持 Win、Mac 和 Linux 平台。该组织采购了一家俄罗斯公司""YURION""的硬件设备产品，该公司是一家俄罗斯的安全防务公司，专门出售无线电监听、窃听等设备，该组织有可能使用该公司的一些特殊硬件设备直接对目标的通讯等信号进行截取监听。 该组织的后门技术主要通过改造正规软件(如TeamViewer Hijacker、RMS Hijacker' )、自主研发( 如Harpoon后门 )和采购商业木马(如HackingTeam 商业后门)这三种方式进行。其绝大部分受害者都集中在哈萨克斯坦国境内，主要涉及政府机关、航空航天、教育、军方、媒体和政府异见人士等，除此以外，还有部分中国背景的受害者，涉及我方与哈萨克合作项目组和驻哈教育机构，而极少数的受害者位于我国西北部地区。"
83,2019 (398),Lazarus组织使用Mac后门，针对韩国目标,2019-11-21,TrendMicro,暂无数据,APT-C-26,趋势科技研究人员最近发现Mac后门新变种，该变种归因于Lazarus。该样本使用了带有嵌入式宏的Excel文档，一旦运行，宏将运行PowerShell脚本，并尝试连接到三个C2服务器。除此之外，研究人员还发现一个Mac应用程序包，该程序与恶意的电子表格共享类似的C2服务器。Mac应用程序包包含两个Flash Player文件：一个合法版本和一个恶意版本。程序运行时，合法的Flash Player运行播放诱饵SWF视频，播放视频的同时恶意程序将创建隐藏木马后门，该后门功能类似于发现的PowerShell后门。
84,2019 (398),新恶意下载器DePriMon，使用端口监视器技术实现持久性,2019-11-21,ESET,暂无数据,LambertsLonghorn,"ESET研究人员最近发现了名为DePriMon的恶意下载器，该恶意软件在中欧的一家私人公司和中东的数十台计算机中被发现，并且至少从2017年3月开始就处于活动状态。安装后，为了实现持久性，恶意软件注册一个新的本地端口监视器，并将自身配置成名为""Windows默认打印监视器驱动程序""的打印监视器，其配置文件以加密格式存储在％Temp％文件夹中，当恶意软件需要读取文件时，它将对文件解密，将其读取到内存中，然后再次对文件进行加密。恶意程序加载后使用TLS加密与其命令和控制服务器进行通信。目前还不知道该恶意软件的感染方式和提供的最终有效负载。但是发现，该恶意软件和 APT组织Lamberts(又名Longhorn)使用的ColoredLambert恶意软件一起在某些受害系统被发现。"
85,2019 (398),卡巴斯基2020年APT攻击预测,2019-11-20,Kaspersky,暂无数据,APT-C-26,卡巴斯基通过对过去12个月的APT攻击的总结，预测了2020年可能发生的APT攻击趋势：攻击会趋向于伪装自身的身份将研究人员的注意力转移到另一个攻击组织上，如Lazarus、WildNeutron、Hades等都有过此种行为；攻击将倾向于针对性的勒索软件；滥用在线支付来进行欺诈；更多的基础架构攻击和针对非PC目标的攻击；亚欧贸易路线的地区的攻击将增加；攻击方法越来越复杂；攻击目标的重点将变为移动设备；滥用个人的隐私信息辅助进行攻击。
86,2019 (398),Raccoon信息窃取木马最新活动，利用Dropbox共享托管负载,2019-11-20,Cofense,暂无数据,暂无数据,"国外研究人员发现了信息窃取程序Raccoon的最新活动。攻击者将恶意的.IMG文件托管在Dropbox共享上，通过受损电子邮件账户发送""电子转账""主题钓鱼邮件，其中包括指向恶意负载的Dropbox链接，该方式成功地通过了赛门铁克电子邮件安全系统和微软EOP网关。一旦用户点击链接，将下载恶意负载。Raccoon向C2服务器发送一个包含""bot ID""和""configuration ID""的HTTP POST请求，与C2进行初始联系。C2返回一个JSON对象进行响应，内容中包括C2数据和函数库、其他文件的有效负载位置。Raccoon主要目标是窃取感染系统存储的信用卡信息、加密货币钱包、浏览器数据和电子邮件凭据等数据。"
87,2019 (398),黑客组织(TA2101)模仿美国、德国、意大利的政府机构，通过钓鱼邮件分发勒索软件、后门木马,2019-11-14,Proofpoint,暂无数据,TA2101,"国外研究人员发现一个新黑客组织(TA2101)模仿美国、德国、意大利的政府机构，通过钓鱼邮件分发勒索软件、后门程序和银行木马。针对德国IT支持公司的钓鱼邮件冒充德国联邦财政部，伪装成用户欠税通知，里面包含恶意的Word文档附件，一旦用户打开附件并启用宏，将安装Cobalt Strike和Maze勒索软件。针对意大利组织的钓鱼邮件冒充意大利税务局，伪装成新税收准则，一旦用户打开恶意附件文档，将被指引""启动内容""解密文件，一旦启用则会执行恶意宏，安装Maze勒索软件。针对美国医疗保健行业的钓鱼邮件冒充美国邮政服务，同样提供恶意Word文档附件，手法与针对意大利的活动类似，但最终安装的是IceID银行木马。"
88,2019 (398),疑似海莲花又有新活动，攻击目标似为国内大型企业,2019-11-13,安恒信息,暂无数据,APT32APT32海莲花APT-C-00Ocean LotusCobalt KittySeaLotus,近期安全研究院猎影威胁分析团队在文件威胁分析平台上监控发现疑似海莲花组织又有新的活动出现，其攻击目标似为国内大型企业。
89,2019 (398),APT33组织使用多层混淆策略，隐藏其C2基础设施,2019-11-13,TrendMicro,暂无数据,APT33Elfin,趋势科技最近研究分析表明，APT33组织使用了大约12个实时C2服务器进行定向攻击活动，目标包括中东、美国和亚洲的组织。这些C2域通常托管在云托管代理上，这些代理将来自受感染bots的URL请求转发到共享web服务器的后端，共享web服务器可能托管数千个合法域。后端将漫游器数据回传给专用IP地址上的数据聚合器和漫游器控制服务器。APT33通过带有频繁更改的出口节点的私有VPN网络连接到这些聚合器，然后APT33向bots发出命令，并使用这些VPN 连接从bots收集数据。研究人员通过对该组织私人VPN出口节点的跟踪，发现其中一些IP地址对中东的一家石油勘探公司和军事医院以及美国的一家石油公司的网络进行了侦察。同时，APT33还利用其私有VPN网络访问渗透测试公司网站、网络邮件、漏洞网站、加密货币相关网站，以及阅读黑客博客和论坛。
90,2019 (398),安卓银行木马Cerberus最新发现,2019-11-12,Anomali,暂无数据,暂无数据,"Cerberus安卓银行木马是一款商业性质木马，在俄罗斯黑客论坛XSS[.]is出售，其作者使用Twitter账户@AndroidCerberus进行推广。该银行木马具备发送短信、拦截短信、伪造银行页面等功能。其目标为全球的银行组织、电子商务、金融、电信等行业。Cerberus木马(92aa486aee73546da0a5e153036b3ab8fd8a29525eb4a4885f1e9952fc2df0d0)的C2信息存储在其配置文件""settings.xml""文件中。C2域brickgeld24k[.]su 于2019年9月8日注册，其他C2域(brickgeld25sk[.]su、brickgeld001kz[.]su、brickgeld049ik[.]su)还没有解析记录。该木马利用计步器程序启动，当计步器(测量步数)达到特定步数时变为活动状态。"
91,2019 (398),勒索软件PureLocker通过暗网销售，针对企业进行定向攻击,2019-11-12,INTEZER,暂无数据,FIN6,"国外研究人员发现勒索软件PureLocker针对企业生产服务器的定向攻击，该勒索软件在暗网出售，并已经被Cobalt Gang，FIN6和其他威胁组使用。PureLocker采用PureBasic编程语言编写，拥有Windows和Linux变种版本。恶意DLL文件伪装成名为Crypto++的C++加密算法库，被regsrv32.exe作为COM服务器的一个DLL文件执行。PureLocker使用硬编码的RSA密钥，采用标准AES + RSA组合对受害者计算机上的文件进行加密，并未加密后的文件添加"".CR1""扩展名，加密完成后会在用户桌面留下名为YOUR_FILES.txt的赎金票据文件。研究人员通过比较PureLocker勒索软件样本和最近的more_eggs加载器样本，认为二者极有可能是由同一作者创建的。"
92,2019 (398),APT组织Platinum仍然活跃，更新两种后门工具,2019-11-11,Kaspersky,暂无数据,TwoForOnePlatinum,卡巴斯基实验室人员发布分析报告称2018年7月针对东南亚国家，外交、政府和军事实体的攻击活动EasternRoppels可能与APT组织Platinum有关。其攻击工具的特点是多阶段执行，利用新的隐写术来隐藏通信过程。这次更新的TTPs是Steganography后门和在它基础上改进的P2P后门。
93,2019 (398),Paradise勒索病毒最新变种分析,2019-11-11,瑞星,暂无数据,暂无数据,Paradise勒索病毒最早出现在2018年7月，最新发现的变种以.NET框架开发，运行后使用对称加密算法或非对称加密算法RSA对受害者文件进行加密，再使用RSA算法加密密钥，病毒几乎会加密所有的文件类型(html除外)，被加密文件后缀为'.safe'，没有作者私钥的情况下暂时无法解密文件。
