,年份,报告标题,披露时间,披露机构,攻击方法,组织别名,报告摘要
53,2019 (398),黑客组织海莲花攻击宝马汽车集团，窃取商业机密,2019-12-06,360,暂无数据,APT32APT32海莲花APT-C-00Ocean LotusCobalt KittySeaLotus,"根据国外新闻报道，黑客组织海莲花攻击了慕尼黑宝马汽车公司（始于2019年春季）的计算机网络和韩国现代汽车网络。6月份时，宝马公司将有关计算机进行了脱网处理。黑客通过创建一个仿冒泰国宝马分公司网站来进行钓鱼，从而窃取目标信息。分析发现黑客组织应是从BR Recherche攻击了计算机攻击者，然后安装Cobalt Strike来进行攻击。自2018年底以来，汽车工业也逐步成海莲花组织的关注焦点。不止于宝马，丰田汽车公司也曾惨遭""海莲花""毒手。通过进一步发现，2019年6月越南企业集团Vingroup开设了第一家生产汽车的工厂。而有资料显示，在越南开始制造汽车时，该组织就开始将攻击目标聚焦于汽车制造商。"
54,2019 (398),伊朗黑客攻击组织利用ZeroCleare，攻击中东能源和工业部门,2019-12-05,threatpost,暂无数据,APT34OilRig,研究人员称，ZeroCleare很可能是总部位于伊朗的APT34(又称OilRig或ITG13)的杰作。根据IBM的X-Force事件响应和情报服务（IRIS），ZeroCleare参与了最近发现的对石油和天然气公司的APT攻击，其中包括 Windows计算机通过易受攻击的驱动程序。尽管IRIS的一位发言人表明，受影响组织的确切数目尚不清楚，但至少有1400台主机受到ZeroCleare的影响。
55,2019 (398),“海莲花”(OceanLotus)2019年针对中国攻击活动汇总,2019-12-05,腾讯,暂无数据,APT32APT32海莲花APT-C-00Ocean LotusCobalt KittySeaLotus,整个2019年，该组织持续对多个目标不断的进行攻击，使用的鱼叉攻击邮件主题非常本土化，如使用网易邮箱，贴近时事热点等。新增诱饵类型：伪装为word图标的可执行文件、chm文件等。不断更新对抗方式：使用多重载荷攻击、定制化第二阶段后门，C2拼接，自增文件大小等。利用的定制化恶意软件为：CobaltStrike的beacon木马、Denis家族木马、修改版的Gh0st。
56,2019 (398),奇安信斩断东北亚APT组织“虎木槿”伸向国内重要机构的魔爪,2019-12-05,奇安信,暂无数据,虎木槿,通过取证溯源分析，奇安信威胁情报中心红雨滴团队已完整捕获相关APT组织利用漏洞攻击的全过程。目标包括多个国内核心教育科研政府机构和个人，只要受攻击目标使用特定浏览器近期的版本打开网页就可能中招，被黑客植入后门木马甚至完全控制电脑。分析显示，该攻击利用了多个较老版本的Chrome浏览器内核的漏洞，国内外使用了这些较老版本渲染核心且没有对应漏洞缓解措施的浏览器用户成为本次APT攻击的目标。
57,2019 (398),大规模GhostDNS攻击活动再现巴西,2019-12-05,Avast,暂无数据,暂无数据,"GhostDNS，是由复杂的攻击脚本组合而成的漏洞利用攻击套件。这些脚本会劫持路由器设置，用其它 DNS 服务顶替，然后将流量引导至“克隆”后的大型在线服务提供商的登陆页面。当访问受感染的站点时，受害者会在不知不觉中被重定向到路由器攻击工具包登录页面，该页面通常在新窗口或新标签页中打开，无需用户干预即可自动发起对路由器的攻击。 然后，漏洞利用工具包尝试在网络上找到路由器IP，然后进行暴力破解。攻击者成功登录路由器后，漏洞利用工具包将尝试使用各种CSRF请求更改路由器的DNS设置，将受害者的请求发送到旨在看起来像受害者想要访问的实际网站的钓鱼页面。 网上银行网站和Netflix之类的网站经常受到DNS劫持攻击，因为攻击者可以轻松窃取有价值的登录凭据。 2019年11月25日，安全公司Avast在巴西检测到的攻击活动相关的URL数量达到近5,500，第二天超过1,000，总共发现了对恶意URL7,500次访问请求。每个GhostDNS登录页面（在这里是针对巴西的银行和Netflix用户的钓鱼页面）都包含相同的bit.ly链接，据统计总点击次数接近223,000。"
58,2019 (398),Gamaredon组织针对乌克兰的攻击活动分析,2019-12-05,Anomali,暂无数据,Gamaredon,国外研究人员发现俄罗斯APT组织Gamaredon的最新活动，该活动从2019年10月中旬持续到11月末，主要针对乌克兰的政府实体和个人，包括外交官、政府雇员、记者、执法人员、军官、非政府组织(NGO)、乌克兰外交部。攻击者向目标分发带有恶意附件的钓鱼邮件，初始诱使文档不包含恶意宏，而是诱导目标下载文档模板(.dot)文件，该.dot文件包含恶意VBA宏，当用户查看诱饵文档时，它会在后台自动执行下载运行恶意负载。恶意程序将VBScript文件移动到启动文件夹中进行持久化。为了避免基于字符串的检测，VBScript文件行在释放恶意负载后被分解，同时会禁用VBA宏警告来逃避检测。
59,2019 (398),Nemty勒索病毒结盟僵尸网络，黑产合作已成趋势威胁倍增,2019-12-04,奇安信,勒索软件,暂无数据,奇安信病毒响应中心发现Nemty勒索家族新变种开始肆虐，目前已经监测到国内有用户陆续中招，由于新变种暂无解密工具，我们提醒政企用户多加防范。 Nemty勒索在国内主要通过弱口令爆破的方式进行传播，本次捕获到的新变种为2.2版本，添加的文件名后缀. NEMTY_。相较于之前版本，除了代码结构的改变，新变种同时提供了Tor浏览器和Web浏览器两种沟通模式，而且限定了交易时间，如果三个月内不支付赎金，网站将会停止支付赎金服务可能导致数据永久损失。
60,2019 (398),KurdishCoder活动使用多种混淆工具，针对区块链行业,2019-12-04,TrendMicro,暂无数据,暂无数据,2019年11月，传播Capesand漏洞利用工具包的活动被揭露，该工具包利用Adobe Flash和Microsoft Internet Explorer中的最新漏洞，同时具有强大的混淆功能，使其释放的样本几乎很难被检测到。其中一个部署njRat恶意软件的样本，其主要可执行文件NotepadEx同时使用了混淆工具ConfuserEx和Cassandra (CyaX)。恶意负载经过CyaX混淆后再通过定制版本的ConfuserEx混淆，使恶意软件几乎完全不能被检测到。ConfuserEx是一个开源工具，在Github上托管了多个版本，研究人员认为定制版本的ConfuserEx来源之一可能是在线服务Cassandra Crypter，该服务提供自定义版本工具。研究人员将使用这种混淆方式的活动命名为KurdishCoder活动。
61,2019 (398),新型破坏性擦除器ZeroCleare指向了中东的能源部门,2019-12-04,Security Intelligence,恶意软件,暂无数据,鉴于该地区以破坏性恶意软件为目标的组织的发展，我们发现ZeroCleare与Shamoon恶意软件具有相似之处并不感到惊讶。以出一页的Shamoon剧本，ZeroCleare旨在覆盖主引导记录（MBR）和磁盘分区在基于Windows的机器。就像Shamoon之前所做的那样，攻击中选择的工具是EldoS RawDisk，这是用于与文件，磁盘和分区进行交互的合法工具包。EldoS的使用并不是由于该软件中的缺陷或漏洞。民族团体和网络犯罪分子经常以合法手段使用供应商不打算完成恶意或破坏性活动的方式。
62,2019 (398),新型下载器Buer积极销售，传播多种有效负载,2019-12-04,Proofpoint,暂无数据,暂无数据,"国外研究人员最近揭露一款新型下载器(名为Buer)正在地下市场积极销售，旨在为寻求完整现成解决方案的网络威胁行动者使用。该恶意软件通过包含恶意Microsoft Office宏代码的电子邮件附件传播，通过配置注册表RunOnce来设置持久性。加载的第二阶段有效载荷包括KPOT stealer，Amadey和Smoke Loader。命令和控制(C&amp;C)功能通过HTTP(s)GET请求进行处理，从C&amp;C服务器下载的有效载荷是通过对""download API""的请求来完成的。Buer控制面板支持Docker容器，以易于集成到租用的Docker主机中，从而简化安装，目前该加载器还在积极开发中。"
63,2019 (398),IcedID木马新变种，利用隐写术隐藏payloads,2019-12-03,Malwarebytes LABS,暂无数据,TA2101,"安全研究人员发现威胁组织TA2101针对德国、意大利和美国的垃圾邮件活动。在针对美国的恶意活动中分发了IcedID银行木马，该木马从2019年9月开始使用隐写术策略隐藏负载。垃圾邮件据称来自美国邮政局，使用""USPS发送失败的尝试通知""主题，其中包含Microsoft Word文档格式附件，该文档诱使受害者启用宏来查看文档内容。用户启用宏后，会显示一个虚假的错误消息提示，提示表单中的标签内容为使用逗号隔开的数字，宏从标签中获取文本，将其转换成恶意负载链接地址或者路径以在执行期间使用。IcedID的加载程序是一个打包的PE文件，用于加载和注入无头的IcedID主模块PE文件。与以前的IcedID木马不同，新的无头的IcedID主模块PE文件需要通过加载其他有效负载(photo.png)才能生成。首先下载器会下载经过混淆模糊的png格式有效负载(photo.png)，再将其解码并注入无头的PE文件生成最终的IcedID主模块PE文件，然后通过IcedID自定义的加载程序加载生成最终有效负载，从而实现持久性。"
64,2019 (398),追踪奥地利钓鱼木马，回顾仿冒美团钓鱼事件,2019-12-03,奇安信,暂无数据,暂无数据,"奇安信病毒响应中心最近发现了一款仿冒奥地利""Willhaben""软件的钓鱼木马APP。该钓鱼木马通过仿冒成""Willhaben""APP，窃取用户个人信息，并向用户发送含有钓鱼链接的短信。该恶意软件主要目是进行钓鱼。恶意程序运行后会诱骗用户激活设备管理器，并可通过远控指令隐藏APP图标，从而达到保护自身。其会通过服务端下发远控指令，包括向服务器发送用户手机状态、发送用户手机号码、发送用户手机短信、发送用户已安装的APP信息、实时对用户手机进行监控等。攻击者会根据获取到的信息，向指定用户发送钓鱼短信，诱骗用户打开钓鱼页面并预付款，从而达到诱骗钱财的目的。目前其短信中显示的钓鱼页面已无法正常显示。近期也出现了模仿中国国内的美团、饿了么平台的大规模短信钓鱼事件。当用户访问钓鱼页面时，攻击者会通过用户提供的银行卡账号、密码进行转账操作，并诱骗用户填写银行二次确认短信，从而完成转账操作。"
65,2019 (398),Lazarus组织新MacOS恶意软件分析,2019-12-03,objective-see,暂无数据,APT-C-26,"国外研究人员发现了一个新的MacOS恶意软件样本。该样本能够从远程位置检索有效负载并将其运行在内存中，从而增加取证分析难度。样本软件包名为UnionCryptoTrader，托管在名为""unioncrypto.vip""的网站上，该网站宣传""智能加密货币套利交易平台""。恶意软件包未签名，打开软件包时将会触发操作系统警告。恶意软件使用了启动守护进程技术，在系统内创建了一个""vip.unioncrypto.plist""启动守护进程运行恶意""unioncryptoupdater""以获取持久性。该恶意文件可以收集系统基本信息，如序列号和OS版本，然后发送给C2服务器，C2服务器可以提供下一阶段将要执行的恶意负载。""unioncryptoupdater""具备在内存中远程下载和直接执行有效负载的功能，其通过调用Apple API NSCreateObjectFileImageFromMemory在(mach-O文件)内存缓冲区中创建一个""目标文件映像""，然后使用NSLinkModule方法链接""目标文件映像""，最后，恶意软件会解析内存中的一个符号并直接执行。该恶意软件样本的分发策略及目标行业和Lazarus组织的AppleJeus活动攻击行为极为相似并且存在明显重叠。"
66,2019 (398),研究人员发现新的木马恶意软件PyXie RAT,2019-12-02,THREATVECTOR,暂无数据,暂无数据,BlackBerry Cylance的研究人员警告说，PyXie RAT的功能包括键盘记录，窃取登录凭据和录制视频，并且该木马可以用来传播其他攻击，包括勒索软件。至少从2018年开始，PyXie RAT就一直很活跃，并且高度定制化，这表明投入了大量的时间和资源来构建它。PyXie RAT运动的全部范围仍不确定，但是研究人员已经确定了针对30多个组织的攻击，主要是医疗和教育行业，据信已感染了数百台机器。
67,2019 (398),SQL爆破攻击近期多见，中招系统遭遇流氓软件推装,2019-12-02,腾讯,暂无数据,暂无数据,"腾讯威胁情报中心最近检测到黑产团伙通过SQL爆破攻击方式，投放多种类型病毒木马。攻击者首先使用sql爆破入侵，然后从es[.]ldbdhm.xyz域下载执行多种类型木马，投放的木马均伪装成图片格式(后缀为jpg或png)，包括紫狐木马、多个用于系统提权漏洞(CVE-2018-8120, CVE-2015-1701，MS16-032(CVE-2016-0099))攻击载荷和powershell木马。紫狐木马安装后释放驱动模块隐藏自身行为，并在后台推广安装各类软件，以刷流量获利。根据监测，病毒域名es[.]ldbdhm.xyz从11月初开始活跃至今。"
68,2019 (398),间谍软件CallerSpy，通过伪装成谷歌网站诱导下载,2019-12-02,TrendMicro,暂无数据,暂无数据,趋势科技研究人员在伪装成GOOGLE的诱骗网站http://gooogle[.]press/上，发现伪装成聊天应用程序(5月份发现的软件名为Chatrious，10月份发现的软件名为Apex App)的新间谍软件系列，该程序可以窃取用户个人信息。趋势科技将这两种恶意程序命名为CallerSpy间谍软件系列。CallerSpy声称是一个聊天应用程序，但是其根本不具备聊天功能。当启动时，CallerSpy通过Socket.IO启动与C2服务器之间的连接，以监听C2服务器命令。然后，利用Evernote Android-Job调度作业来窃取信息，包括设备上的呼叫日志、SMS、联系人和文件信息。除此之外，还从C2服务器接收命令获取屏幕截图，并将其经过Base64编码后发送到服务器。所有的被盗信息都会被存在本地数据库中，然后定期上传到C2服务器。对其使用的基础设施进行分析，发现诱骗网站域名gooogle[.]press伪装成GOOGLE，同时还将伪造的版权信息放在网站底部，其域名注册于2019年1月，并且使用了域隐私保护。研究人员发现四个均托管在合法服务上的C2地址。目前还未发现该恶意软件实际的受害者，诱骗网站提供包括Apple，Android和Windows平台的恶意程序，但目前仅支持Android，因此推测该恶意软件可能还处于测试阶段。
69,2019 (398),Imminent Monitor远程访问木马（IM-RAT）调查报告,2019-12-02,paloalto,暂无数据,暂无数据,"由澳大利亚联邦警局牵头，自2017年开始的一项针对利用Imminent Monitor远程访问特洛伊木马（IM-RAT）进行黑客攻击的长期调查，在2019年11月30日有了正式调查结果，控制服务器已被接管，无法产生新的客户端，该工具已不再提供远控服务，其维护的网络也被执法部门接管。 IM-RAT在黑客工具贩卖网站进行广告宣传，正式售价低至25美元，并且几乎不需要任何技术知识就可部署。 监控显示，自2012年起，IM-RAT至少在115,000次单独攻击中被使用。在执法机构授权后，研究人员发现：2012年，开发人员“ Shockwave™”注册了域imminentmethods.info信息，并于2013年4月开始在在线论坛和他的网站上出售其“ Imminent Monitor” RAT，后来该站点改为imminentmethods.net。 2014年，Imminent Monitor开始支持第三方插件。 其中一个提供了在监视时关闭网络摄像头灯的功能。 较新的版本提供了“ HRDP”（隐藏的远程桌面协议），它提供了对受害者隐藏的非交互式远程桌面连接。第3版引入了在受害机器上运行加密货币矿工的功能。"
70,2019 (398),Rapid变种再袭，不仅加密不可修复，还随机修改文件名,2019-11-29,腾讯,暂无数据,暂无数据,腾讯安全御见威胁情报中心检测到，Rapid勒索病毒变种在国内开始再度活跃，该病毒首次出现于2017年，由于早期该病毒加密文件后缀为Rapid，因此得名。自该病毒出现起，该病毒每年都会给一些国内企业造成不可逆转的加密破坏。Rapid勒索病毒在国内主要通过弱口令爆破方式传播，本次检测到国内变种加密文件完成后，会对其文件添加扩展后缀.cryptolocker。
71,2019 (398),RTM银行木马再现北亚，针对石油业发起持续攻击,2019-11-29,奇安信,暂无数据,暂无数据,奇安信病毒响应中心在日常威胁追踪中发现，一例针对俄罗斯鄂木斯克州，一家与石油相关的公司的攻击活动。攻击入口依旧为邮件，通过向公司公开邮箱中发送诱饵邮件获得攻击入口。攻击目的为植入后门程序以及获取目标机器上的浏览器本地凭证信息。
72,2019 (398),月光再临——MoonLight组织针对中东地区的最新攻击活动剖析,2019-11-29,奇安信,暂无数据,,"自2019年4月以来，奇安信研究人员监测到一批针对巴勒斯坦及加沙地区的网络攻击活动。该活动与近期部分厂商发布的多篇定性为""拍拍熊(APT-C-37)""的报告存在高度重合，根据研判分析，奇安信研究人员认为该攻击活动正是来自于Moonlight组织。该批次样本初始恶意载荷都是通过将自解压文件(SFX)伪装为doc、jpg等文本图片形式达到混淆目的。攻击者在活动中不断使用新的策略，包括使用VBS脚本加载执行history.ink，ink文件会将恶意URL作为参数调用mstha程序，以完成恶意负载下载。以及在自解压过程中调用mstha访问恶意URL后下载带包含后门的混淆恶意脚本，并利用Powershell加载执行完成自身解密后展示最终的后门。其样本经过解混淆后释放H-Worm后门程序，所使用后门版本删去了Sleep等休眠命令，只保留了核心功能。"
73,2019 (398),TICK组织ENDTRADE活动，使用多阶段后门针对日本目标,2019-11-29,TrendMicro,暂无数据,TickREDBALDKNIGHTBronze Butler,"趋势科技最近揭露了网络间谍组织TICK(又名""BRONZE BUTLER""和""REDBALDKNIGHT"")的最新活动。该组织使用合法的电子邮件账户和证书传播恶意软件，针对国防、航空航天、化学和卫星行业，这些行业的总部在日本，在中国有子公司。在2019年1月，该组织通过窃取日本经济研究公司和公共关系(PR)机构的电子邮件凭据和文件，并将其作为鱼叉式钓鱼邮件发送给精通日语或中文并且对中国经济感兴趣的个人和公司，邮件中包含带有恶意软件有效负载附件。该组织在活动中使用两个新的下载器ABK和BBK，两个新的木马Snake和build_down，这些恶意软件都具有一项重要任务：连接到网站并验证受害系统的卷序列号，以确定是否将发送下载后门的命令，在多个驱动器或卷的实例中，下载器从驱动器C收集信息。TICK还利用Microsoft Office内存损坏漏洞CVE-2018-0802和CVE-2018-0798传播ABK和BBK恶意软件。ABK使用隐写术将额外的负载隐藏在照片中以绕过杀毒软件。BBK同样使用隐写术隐藏恶意负载，其可以从C2服务器网站下载特定文件收集受害者信息，但是该软件不执行命令，研究人员因此推测该工具还在开发阶段。"
74,2019 (398),RevengeHotels活动针对全球酒店业，窃取旅客信用卡数据,2019-11-28,Kaspersky,暂无数据,暂无数据,卡巴斯基最近揭露了针对全球酒店行业的网络犯罪活动RevengeHotels，该活动主要针对巴西的酒店、旅馆和旅游公司。研究人员已经确认超过20家酒店成为该活动的受害者，其目标是获取酒店系统中的旅客来宾信用卡数据，以及从流行在线旅行社(如Booking.com)接收的信用卡数据。攻击者通过发送带有精心制作的Word、Excel文档的鱼叉钓鱼邮件，以引导目标下载，为了增加可信度，攻击者还通过抢注域名冒充合法公司。其中一些恶意负载使用了Microsoft Office OLE功能远程代码执行漏洞(CVE-2017-0199)来加载和执行恶意代码。然后在受害者计算机中安装定制版本的RevengeRAT，njRAT，NanoCoreRAT，888 RAT和其他自定义恶意软件(如ProCC)。该活动组织自2015年来一直活跃，2019年加大了攻击力度。研究人员根据基础设施和技术的差异，将该活动(PaloAlto称为Comando活动)归因于两个团体，一个命名为RevengeHotels，一个命名为ProCC。
75,2019 (398),安卓银行木马Ginp使用覆盖攻击，窃取信用卡信息,2019-11-28,threatfabric,暂无数据,暂无数据,"国外研究人员最近发现了一种新型银行恶意软件Ginp，该恶意软件在过去五个月里一直处于积极开发状态，至少发布了5种不同版本。最初的版本伪装成""Google Play验证程序""应用，其目的只是窃取SMS消息。现在，其重心逐渐转移到支付卡信息窃取上。最近的版本使用了Anubis木马的部分源代码，并且针对多个西班牙银行应用程序。最新版本伪装成""Adobe Flash Player""应用程序，通过向用户要求提供Accessibility Service特权，以获取能够发送消息和调用的动态权限。完成后，木马伪装成默认的SMS应用程序，提供短信收集和转发、更新C2的功能。Ginp同时针对银行应用启用覆盖攻击，其首先窃取受害者的登录凭据，然后窃取信用卡信息以验证用户身份。"
76,2019 (398),针对SQL弱口令的爆破攻击再度袭来，KingMiner矿工已控制上万台电脑,2019-11-26,腾讯,暂无数据,暂无数据,腾讯安全御见威胁情报中心检测到KingMiner变种攻击，KingMiner是一种针对Windows服务器MSSQL进行爆破攻击的门罗币挖矿木马。该木马最早于2018年6月中旬首次出现，并在随后迅速发布了两个改进版本。木马利用Windows权限提升漏洞CVE-2019-0803在内核模式下执行任意代码。然后通过WMI定时器和Windows计划任务实现持久化，使用base64和特定编码的XML，TXT，PNG文件来加密木马程序。利用微软和多个知名厂商的签名文件作为父进程，使用白加黑劫持技术启动木马DLL，同时会关闭机器上RDP服务防止其他挖矿团伙入侵，以独占已控制的服务器资源。KingMiner影响超过一万台电脑，其中受影响最严重的地区为中国广东、重庆、北京、上海等地。
77,2019 (398),Stantinko僵尸网络分发矿工，利用YouTube存储矿池代理,2019-11-26,ESET,暂无数据,暂无数据,最近，研究人员发现Stantinko僵尸网络至少从2018年8月开始分发门罗币矿工获取利益。该僵尸网络至少从2012年起就开始活跃，主要针对俄罗斯、乌克兰、白俄罗斯和哈萨克斯坦的用户。之前，该僵尸网络进行了点击欺诈，广告注入，社交网络欺诈和密码窃取攻击。矿工模块是xmr-stak开源cryptominer的高度修改版本，该模块通过挖掘加密货币来耗尽受感染机器的大部分资源。为了逃避检测，矿工程序会删除所有不必要的字符串甚至整个功能，其余的字符串和函数被严重混淆。并且不会直接与其矿池进行通信，而是通过从YouTube视频的描述文本中获取其IP代理进行通信。同时还具备暂停其他矿工，检测安全软件等功能。如果矿工程序检测到机器未连接任何电源，则暂停采矿，以防止电池耗尽引起用户怀疑。
78,2019 (398),无孔不入： NextCry勒索病毒利用PHP最新漏洞攻击传播,2019-11-25,奇安信,暂无数据,暂无数据,奇安信病毒响应中心发现NextCry勒索软件的新传播方式。NextCry勒索是一种新型勒索软件，该勒索由Python编写并使用PyInstall打包成Linux ELF二进制文件，采用RSA-2048和AES-256-CBC算法加密指定目录下的文件，无法解密。发现其正在利用PHP-fpm远程代码执行漏洞(CVE-2019-11043)针对Linux服务器发起攻击尝试入侵，利用此漏洞可以在受影响的服务器上远程执行任意命令，在启用PHP-Fpm的Nginx服务器上运行某些版本的PHP 7有可能受到攻击，没有运行Nginx服务器理论上则不会产生影响。目前该勒索软件主要攻击安装有Nextcloud软件的服务器，因为Nextcloud软件默认情况下开启Nginx服务器，所以几乎所有的基于Nextcloud的云盘都会受到影响。奇安信威胁情报中心目前已经检测到有用户中招。
79,2019 (398),Trickbot更新密码收集器模块，针对OpenSSH和OpenVPN,2019-11-22,paloalto,暂无数据,暂无数据,国外研究人员发现Trickbot更新密码收集器模块，在模块中添加了窃取OpenSSH私钥以及OpenVPN密码和配置文件功能。Trickbot的密码收集器模块(pwgrab64)，会检索存储在受害者浏览器缓存中的登录凭据，并且还从其他应用程序窃取登录凭据。窃取的信息使用未加密的HTTP协议，通过TCP端口8082发送到Trickbot使用的C2地址。研究人员发现，在最近的检测中，Trickbot使用HTTP POST请求将OpenSSH私钥以及OpenVPN密码和配置文件发送到其命令和控制服务器，但是相关字段并没有实际数据，这表明该功能可能还处于测试阶段。
